{
    "title": "Cyril Ramaphosa closes G20 summit after US boycott and handover row",
    "deck": "South African president bangs gavel after rejecting plan from US, which hosts next meeting, for him to hand over to junior official South Africa’s president, Cyril Ramaphosa, closed the G20 summit in Johannesburg by banging a gavel, having rejected a US proposal for him to hand over to a relatively junior embassy official for the next summit in Florida in a year’s time. South Africa presented the two-day event as a triumph for multilateralism but it was marred by a boycott by the US, which has repeatedly accused South Africa of discriminating against white-minority Afrikaners, a claim that has been widely discredited. Continue reading... (https://www.theguardian.com/world/2025/nov/23/cyril-ramaphosa-gavel-g20-summit-us-handover)",
    "author": "Rachel Savage in Johannesburg",
    "source": "Guardian World",
    "timestamp": "Sun, 23 Nov 2025 15:08:20 GMT",
    "url": "https://www.theguardian.com/world/2025/nov/23/cyril-ramaphosa-gavel-g20-summit-us-handover",
    "tags": "",
    "status": "",
    "draft_text": "South African president bangs gavel after rejecting plan from US, which hosts next meeting, for him to hand over to junior official South Africa’s president, Cyril Ramaphosa, closed the G20 summit in Johannesburg by banging a gavel, having rejected a US proposal for him to hand over to a relatively junior embassy official for the next summit in Florida in a year’s time. South Africa presented the two-day event as a triumph for multilateralism but it was marred by a boycott by the US, which has repeatedly accused South Africa of discriminating against white-minority Afrikaners, a claim that has been widely discredited. Continue reading... (https://www.theguardian.com/world/2025/nov/23/cyril-ramaphosa-gavel-g20-summit-us-handover)\n\n(Continue writing here…)",
    "yaml_text": "title: Cyril Ramaphosa closes G20 summit after US boycott and handover row\nsummary: South African president bangs gavel after rejecting plan from US, which hosts\n  next meeting, for him to hand over to junior official South Africa’s president,\n  Cyril Ramaphosa, closed the G20 summit in Johannesburg by banging a gavel, having\n  rejected a US proposal for him to hand over to a relatively junior embassy official\n  for the next summit in Florida in a year’s time. South Africa presented the two-day\n  event as a triumph for multilateralism but it was marred by a boycott by the US,\n  which has repeatedly accused South Africa of discriminating against white-minority\n  Afrikaners, a claim that has been widely discredited. Continue reading... (https://www.theguardian.com/world/2025/nov/23/cyril-ramaphosa-gavel-g20-summit-us-handover)\nsource: Guardian World\ntimestamp: Sun, 23 Nov 2025 15:08:20 GMT\nauthor: Rachel Savage in Johannesburg\nurl: https://www.theguardian.com/world/2025/nov/23/cyril-ramaphosa-gavel-g20-summit-us-handover\nbody: 'South African president bangs gavel after rejecting plan from US, which hosts\n  next meeting, for him to hand over to junior official South Africa’s president,\n  Cyril Ramaphosa, closed the G20 summit in Johannesburg by banging a gavel, having\n  rejected a US proposal for him to hand over to a relatively junior embassy official\n  for the next summit in Florida in a year’s time. South Africa presented the two-day\n  event as a triumph for multilateralism but it was marred by a boycott by the US,\n  which has repeatedly accused South Africa of discriminating against white-minority\n  Afrikaners, a claim that has been widely discredited. Continue reading... (https://www.theguardian.com/world/2025/nov/23/cyril-ramaphosa-gavel-g20-summit-us-handover)\n\n\n  (Continue writing here…)'\n",
    "yaml_buffer": {},
    "write_dirty": false,
    "last_saved_name": "(Design→Write)"
}