{
    "title": "UK rejects Nigerian request to deport former politican jailed for organ trafficking",
    "deck": "Ike Ekweremadu serving prison sentence after being found guilty of conspiring to exploit a man for his kidney The UK government has rejected a request by Nigeria to deport a former senior Nigerian politician convicted of organ trafficking. Ike Ekweremadu, 63, a former deputy president of the Nigerian senate and ally of the former president Goodluck Jonathan, is serving a sentence of nine years and eight months after being found guilty (https://www.theguardian.com/uk-news/2023/mar/23/nigerian-politician-wife-doctor-guilty-organ-trafficking-uk-ike-ekweremadu) in 2023 of conspiring to exploit a man for his kidney. Continue reading... (https://www.theguardian.com/uk-news/2025/nov/24/uk-rejects-nigerian-request-to-deport-former-politican-ike-ekweremadu-jailed-for-organ-trafficking)",
    "author": "Matthew Weaver",
    "source": "Guardian World",
    "timestamp": "Mon, 24 Nov 2025 15:46:29 GMT",
    "url": "https://www.theguardian.com/uk-news/2025/nov/24/uk-rejects-nigerian-request-to-deport-former-politican-ike-ekweremadu-jailed-for-organ-trafficking",
    "tags": "",
    "status": "",
    "draft_text": "Ike Ekweremadu serving prison sentence after being found guilty of conspiring to exploit a man for his kidney The UK government has rejected a request by Nigeria to deport a former senior Nigerian politician convicted of organ trafficking. Ike Ekweremadu, 63, a former deputy president of the Nigerian senate and ally of the former president Goodluck Jonathan, is serving a sentence of nine years and eight months after being found guilty (https://www.theguardian.com/uk-news/2023/mar/23/nigerian-politician-wife-doctor-guilty-organ-trafficking-uk-ike-ekweremadu) in 2023 of conspiring to exploit a man for his kidney. Continue reading... (https://www.theguardian.com/uk-news/2025/nov/24/uk-rejects-nigerian-request-to-deport-former-politican-ike-ekweremadu-jailed-for-organ-trafficking)\n\n(Continue writing here…)",
    "yaml_text": "title: UK rejects Nigerian request to deport former politican jailed for organ trafficking\nsummary: Ike Ekweremadu serving prison sentence after being found guilty of conspiring\n  to exploit a man for his kidney The UK government has rejected a request by Nigeria\n  to deport a former senior Nigerian politician convicted of organ trafficking. Ike\n  Ekweremadu, 63, a former deputy president of the Nigerian senate and ally of the\n  former president Goodluck Jonathan, is serving a sentence of nine years and eight\n  months after being found guilty (https://www.theguardian.com/uk-news/2023/mar/23/nigerian-politician-wife-doctor-guilty-organ-trafficking-uk-ike-ekweremadu)\n  in 2023 of conspiring to exploit a man for his kidney. Continue reading... (https://www.theguardian.com/uk-news/2025/nov/24/uk-rejects-nigerian-request-to-deport-former-politican-ike-ekweremadu-jailed-for-organ-trafficking)\nsource: Guardian World\ntimestamp: Mon, 24 Nov 2025 15:46:29 GMT\nauthor: Matthew Weaver\nurl: https://www.theguardian.com/uk-news/2025/nov/24/uk-rejects-nigerian-request-to-deport-former-politican-ike-ekweremadu-jailed-for-organ-trafficking\nbody: 'Ike Ekweremadu serving prison sentence after being found guilty of conspiring\n  to exploit a man for his kidney The UK government has rejected a request by Nigeria\n  to deport a former senior Nigerian politician convicted of organ trafficking. Ike\n  Ekweremadu, 63, a former deputy president of the Nigerian senate and ally of the\n  former president Goodluck Jonathan, is serving a sentence of nine years and eight\n  months after being found guilty (https://www.theguardian.com/uk-news/2023/mar/23/nigerian-politician-wife-doctor-guilty-organ-trafficking-uk-ike-ekweremadu)\n  in 2023 of conspiring to exploit a man for his kidney. Continue reading... (https://www.theguardian.com/uk-news/2025/nov/24/uk-rejects-nigerian-request-to-deport-former-politican-ike-ekweremadu-jailed-for-organ-trafficking)\n\n\n  (Continue writing here…)'\n",
    "yaml_buffer": {},
    "write_dirty": false,
    "last_saved_name": "(Design→Write)"
}